smartctl 7.2 2020-12-30 r5155 [Darwin 19.6.0 x86_64] (local build)
Copyright (C) 2002-20, Bruce Allen, Christian Franke, www.smartmontools.org

=== START OF INFORMATION SECTION ===
Model Number:                       APPLE SSD AP0512N
Serial Number:                      C02014401YPP9K01H
Firmware Version:                   1161.80.
PCI Vendor/Subsystem ID:            0x106b
IEEE OUI Identifier:                0x000000
Controller ID:                      0
NVMe Version:                       <1.2
Number of Namespaces:               1
Local Time is:                      Mon Apr 12 11:46:06 2021 PDT
Firmware Updates (0x02):            1 Slot
Optional Admin Commands (0x0004):   Frmw_DL
Optional NVM Commands (0x0004):     DS_Mngmt
Maximum Data Transfer Size:         256 Pages

Supported Power States
St Op     Max   Active     Idle   RL RT WL WT  Ent_Lat  Ex_Lat
 0 +     0.00W       -        -    0  0  0  0        0       0

=== START OF SMART DATA SECTION ===
SMART overall-health self-assessment test result: PASSED

SMART/Health Information (NVMe Log 0x02)
Critical Warning:                   0x00
Temperature:                        39 Celsius
Available Spare:                    100%
Available Spare Threshold:          99%
Percentage Used:                    0%
Data Units Read:                    16,279,072 [8.33 TB]
Data Units Written:                 12,628,518 [6.46 TB]
Host Read Commands:                 377,312,835
Host Write Commands:                191,010,411
Controller Busy Time:               0
Power Cycles:                       110
Power On Hours:                     331
Unsafe Shutdowns:                   17
Media and Data Integrity Errors:    0
Error Information Log Entries:      0

Read 1 entries from Error Information Log failed: GetLogPage failed: system=0x38, sub=0x0, code=745